[
  {
    "letter": "A",
    "name": "Alien",
    "tier": 1,
    "baseHP": 1,
    "basePoints": 10,
    "movementId": "glide_horizontal",
    "attackId": "pellet_slow",
    "audioPhoneme": "phonemes/en/A.ogg",
    "spriteSet": ["A_idle_1", "A_idle_2", "A_attack_1"],
    "colorTheme": "green",
    "behaviors": ["baseline"]
  },
  {
    "letter": "B",
    "name": "Beetle",
    "tier": 2,
    "baseHP": 2,
    "basePoints": 14,
    "movementId": "zigzag_burst",
    "attackId": "pellet_spread_2",
    "audioPhoneme": "phonemes/en/B.ogg",
    "spriteSet": ["B_idle_1", "B_move_1", "B_attack_1"],
    "colorTheme": "amber",
    "behaviors": ["erratic"]
  },
  {
    "letter": "C",
    "name": "Crab",
    "tier": 3,
    "baseHP": 3,
    "basePoints": 40,
    "movementId": "scuttle_side",
    "attackId": "claw_lateral",
    "audioPhoneme": "phonemes/en/C.ogg",
    "spriteSet": ["C_idle_1", "C_move_1", "C_attack_1"],
    "colorTheme": "coral",
    "behaviors": ["mini_boss", "lateral"]
  },
  {
    "letter": "D",
    "name": "Dragon",
    "tier": 4,
    "baseHP": 4,
    "basePoints": 55,
    "movementId": "sine_hover",
    "attackId": "flame_cone_dot",
    "audioPhoneme": "phonemes/en/D.ogg",
    "spriteSet": ["D_idle_1", "D_hover_1", "D_flame_1"],
    "colorTheme": "crimson",
    "behaviors": ["dot", "cone"]
  },
  {
    "letter": "E",
    "name": "Eagle",
    "tier": 2,
    "baseHP": 2,
    "basePoints": 18,
    "movementId": "high_dive",
    "attackId": "dive_strike",
    "audioPhoneme": "phonemes/en/E.ogg",
    "spriteSet": ["E_idle_1", "E_dive_1", "E_attack_1"],
    "colorTheme": "sapphire",
    "behaviors": ["diver"]
  },
  {
    "letter": "F",
    "name": "Formidable Fighter",
    "tier": 3,
    "baseHP": 3,
    "basePoints": 30,
    "movementId": "slow_drift_shield",
    "attackId": "charged_heavy",
    "audioPhoneme": "phonemes/en/F.ogg",
    "spriteSet": ["F_idle_1", "F_shield_1", "F_charge_1"],
    "colorTheme": "steel",
    "behaviors": ["armored", "charged"]
  },
  {
    "letter": "G",
    "name": "Ghost",
    "tier": 2,
    "baseHP": 2,
    "basePoints": 16,
    "movementId": "phase_drift",
    "attackId": "visible_only_shot",
    "audioPhoneme": "phonemes/en/G.ogg",
    "spriteSet": ["G_phase_1", "G_phase_2", "G_attack_1"],
    "colorTheme": "mint",
    "behaviors": ["phase"]
  },
  {
    "letter": "H",
    "name": "Hunter",
    "tier": 3,
    "baseHP": 3,
    "basePoints": 28,
    "movementId": "track_x",
    "attackId": "narrow_fast",
    "audioPhoneme": "phonemes/en/H.ogg",
    "spriteSet": ["H_idle_1", "H_track_1", "H_attack_1"],
    "colorTheme": "scarlet",
    "behaviors": ["tracking"]
  },
  {
    "letter": "I",
    "name": "Insect Swarm",
    "tier": 2,
    "baseHP": 2,
    "basePoints": 15,
    "movementId": "cluster_drift",
    "attackId": "micro_pellets_swarm",
    "audioPhoneme": "phonemes/en/I.ogg",
    "spriteSet": ["I_swarm_1", "I_swarm_2", "I_attack_1"],
    "colorTheme": "lime",
    "behaviors": ["swarm"]
  },
  {
    "letter": "J",
    "name": "Jet",
    "tier": 3,
    "baseHP": 3,
    "basePoints": 26,
    "movementId": "horizontal_dash",
    "attackId": "backward_exhaust",
    "audioPhoneme": "phonemes/en/J.ogg",
    "spriteSet": ["J_idle_1", "J_dash_1", "J_exhaust_1"],
    "colorTheme": "cobalt",
    "behaviors": ["speedster"]
  },
  {
    "letter": "K",
    "name": "Knight",
    "tier": 4,
    "baseHP": 4,
    "basePoints": 48,
    "movementId": "armored_step",
    "attackId": "reflect_then_strike",
    "audioPhoneme": "phonemes/en/K.ogg",
    "spriteSet": ["K_idle_1", "K_shield_1", "K_attack_1"],
    "colorTheme": "iron",
    "behaviors": ["armored", "reflect"]
  },
  {
    "letter": "L",
    "name": "Laser",
    "tier": 4,
    "baseHP": 4,
    "basePoints": 52,
    "movementId": "vertical_bob",
    "attackId": "beam_continuous",
    "audioPhoneme": "phonemes/en/L.ogg",
    "spriteSet": ["L_idle_1", "L_beam_1", "L_beam_2"],
    "colorTheme": "neon",
    "behaviors": ["beam", "channel"]
  },
  {
    "letter": "M",
    "name": "Monster",
    "tier": 4,
    "baseHP": 4,
    "basePoints": 60,
    "movementId": "large_oscillation",
    "attackId": "area_shockwave",
    "audioPhoneme": "phonemes/en/M.ogg",
    "spriteSet": ["M_idle_1", "M_move_1", "M_shock_1"],
    "colorTheme": "violet",
    "behaviors": ["large", "shockwave"]
  },
  {
    "letter": "N",
    "name": "Ninja",
    "tier": 3,
    "baseHP": 3,
    "basePoints": 34,
    "movementId": "short_teleport",
    "attackId": "shuriken_diagonal",
    "audioPhoneme": "phonemes/en/N.ogg",
    "spriteSet": ["N_idle_1", "N_tp_1", "N_attack_1"],
    "colorTheme": "midnight",
    "behaviors": ["teleport", "unpredictable"]
  },
  {
    "letter": "O",
    "name": "Octopus",
    "tier": 5,
    "baseHP": 6,
    "basePoints": 120,
    "movementId": "tentacle_wave",
    "attackId": "ink_radial_slow",
    "audioPhoneme": "phonemes/en/O.ogg",
    "spriteSet": ["O_idle_1", "O_tentacle_1", "O_ink_1"],
    "colorTheme": "teal",
    "behaviors": ["boss", "ink", "radial"]
  },
  {
    "letter": "P",
    "name": "Progressive UFO",
    "tier": 3,
    "baseHP": 3,
    "basePoints": 36,
    "movementId": "progressive_speedup",
    "attackId": "escalating_burst",
    "audioPhoneme": "phonemes/en/P.ogg",
    "spriteSet": ["P_idle_1", "P_move_1", "P_attack_1"],
    "colorTheme": "purple",
    "behaviors": ["progressive"]
  },
  {
    "letter": "Q",
    "name": "Queen",
    "tier": 5,
    "baseHP": 8,
    "basePoints": 200,
    "movementId": "multi_phase_mix",
    "attackId": "summon_minions_spiral",
    "audioPhoneme": "phonemes/en/Q.ogg",
    "spriteSet": ["Q_idle_1", "Q_phase_1", "Q_spiral_1"],
    "colorTheme": "gold",
    "behaviors": ["boss", "queen", "multi_phase"]
  },
  {
    "letter": "R",
    "name": "Robot",
    "tier": 3,
    "baseHP": 3,
    "basePoints": 32,
    "movementId": "clockwork_step",
    "attackId": "timed_volley",
    "audioPhoneme": "phonemes/en/R.ogg",
    "spriteSet": ["R_idle_1", "R_step_1", "R_attack_1"],
    "colorTheme": "gray",
    "behaviors": ["mechanical", "timed"]
  },
  {
    "letter": "S",
    "name": "Shapeshifter Squid",
    "tier": 4,
    "baseHP": 4,
    "basePoints": 58,
    "movementId": "morph_cycle",
    "attackId": "ink_cloud_dim",
    "audioPhoneme": "phonemes/en/S.ogg",
    "spriteSet": ["S_form_1", "S_form_2", "S_ink_1"],
    "colorTheme": "aqua",
    "behaviors": ["shapeshift", "ink"]
  },
  {
    "letter": "T",
    "name": "Tank",
    "tier": 3,
    "baseHP": 3,
    "basePoints": 38,
    "movementId": "slow_push",
    "attackId": "wide_shell",
    "audioPhoneme": "phonemes/en/T.ogg",
    "spriteSet": ["T_idle_1", "T_move_1", "T_shell_1"],
    "colorTheme": "olive",
    "behaviors": ["tank", "heavy"]
  },
  {
    "letter": "U",
    "name": "UFO",
    "tier": 2,
    "baseHP": 2,
    "basePoints": 22,
    "movementId": "hover_dart",
    "attackId": "fast_beam",
    "audioPhoneme": "phonemes/en/U.ogg",
    "spriteSet": ["U_idle_1", "U_hover_1", "U_dart_1"],
    "colorTheme": "silver",
    "behaviors": ["bonus", "saucer"]
  },
  {
    "letter": "V",
    "name": "Viper",
    "tier": 3,
    "baseHP": 3,
    "basePoints": 30,
    "movementId": "serpentine",
    "attackId": "venom_arc",
    "audioPhoneme": "phonemes/en/V.ogg",
    "spriteSet": ["V_idle_1", "V_wave_1", "V_attack_1"],
    "colorTheme": "emerald",
    "behaviors": ["serpentine"]
  },
  {
    "letter": "W",
    "name": "Wasp",
    "tier": 3,
    "baseHP": 3,
    "basePoints": 30,
    "movementId": "buzz_loop",
    "attackId": "rapid_stingers",
    "audioPhoneme": "phonemes/en/W.ogg",
    "spriteSet": ["W_idle_1", "W_buzz_1", "W_attack_1"],
    "colorTheme": "yellow",
    "behaviors": ["aggressive", "buzz"]
  },
  {
    "letter": "X",
    "name": "X-Fighter",
    "tier": 4,
    "baseHP": 4,
    "basePoints": 64,
    "movementId": "cross_pivot",
    "attackId": "x_cross_lasers",
    "audioPhoneme": "phonemes/en/X.ogg",
    "spriteSet": ["X_idle_1", "X_cross_1", "X_laser_1"],
    "colorTheme": "cyan",
    "behaviors": ["lasers", "cross"]
  },
  {
    "letter": "Y",
    "name": "Yamato",
    "tier": 4,
    "baseHP": 4,
    "basePoints": 70,
    "movementId": "slow_cruise",
    "attackId": "turret_salvo",
    "audioPhoneme": "phonemes/en/Y.ogg",
    "spriteSet": ["Y_idle_1", "Y_turret_1", "Y_salvo_1"],
    "colorTheme": "navy",
    "behaviors": ["battleship", "turrets"]
  },
  {
    "letter": "Z",
    "name": "Zapper",
    "tier": 4,
    "baseHP": 4,
    "basePoints": 66,
    "movementId": "zigzag_descent",
    "attackId": "chain_lightning",
    "audioPhoneme": "phonemes/en/Z.ogg",
    "spriteSet": ["Z_idle_1", "Z_zigzag_1", "Z_zap_1"],
    "colorTheme": "electricBlue",
    "behaviors": ["electric", "chain"]
  }
]
